{
  "schema_version": 1,
  "envelope_id": "env_01JZK0",
  "idempotency_key": "run_01JZK0:plan:1",
  "run_id": "run_01JZK0",
  "step_id": "plan",
  "attempt_id": "attempt_01JZK0",
  "status": "succeeded",
  "summary": "Plan recorded",
  "artifacts": [
    { "name": "plan", "uri": "handoff://plan.md", "media_type": "text/markdown" }
  ],
  "notes_for_next_agent": "Implement the accepted plan.",
  "extensions": { "wefty.dev/review": { "required": true } },
  "created_at": "2026-08-09T12:00:00Z"
}
